{
    "schemaVersion": "0.2",
    "project-paths": [
        "ignition-data/projects"
    ],
    "gateways": {
        "frontend": {
            "id": "frontend",
            "ignitionVersion": "8.1.44",
            "environments": {
                "local": {
                    "host": "localhost",
                    "port": 8088,
                    "ssl": false
                },
                "staging": {
                    "host": "frontend.staging.example.com",
                    "port": 443,
                    "ssl": true
                },
                "prod": {
                    "host": "frontend.example.com",
                    "port": 443,
                    "ssl": true
                }
            },
            "defaultEnvironment": "local",
            "enabled": true,
            "projects": [
                "hmi-frontend",
                "shared-utilities"
            ]
        },
        "backend": {
            "id": "backend",
            "ignitionVersion": "8.3.1",
            "environments": {
                "local": {
                    "host": "localhost",
                    "port": 9088,
                    "ssl": false
                },
                "staging": {
                    "host": "backend.staging.example.com",
                    "port": 443,
                    "ssl": true
                },
                "prod": {
                    "host": "backend.example.com",
                    "port": 443,
                    "ssl": true,
                    "modules": {
                        "project-scan-endpoint": {
                            "apiTokenFilePath": "~/.ignition/tokens/backend-prod-api-token"
                        }
                    }
                }
            },
            "defaultEnvironment": "local",
            "enabled": true,
            "projects": [
                "process-backend",
                "shared-utilities"
            ],
            "modules": {
                "project-scan-endpoint": {
                    "enabled": true,
                    "apiTokenFilePath": "~/.ignition/tokens/backend-api-token"
                }
            }
        }
    },
    "settings": {
        "showInheritedResources": true,
        "groupResourcesByType": true,
        "autoRefreshProjects": true,
        "searchHistoryLimit": 50
    }
}
